ID,Author,Subreddit,Title,Number of comments,Time Posted,UTC
qs4pt8,Official_CKM,u_Official_CKM,Finland Warming up for Bitcoin Ransomware Attack with Cyber Fire Drill,0,2021-11-11 23:53:59,1636696439.0
qr427c,procryptoclass,STYLYCRYPT,"Retail Giant Media Markt Hit With $50,000,000 Bitcoin Ransomware Demand in Alleged Attack: Report",0,2021-11-10 15:00:28,1636578028.0
qr4kyw,krypto-news-deutsch,u_krypto-news-deutsch,Einzelhandelsriese Media Markt mit 50.000.000 $ Bitcoin-Ransomware-Nachfrage bei mutmaßlichem Angriff getroffen: Bericht,0,2021-11-10 15:24:02,1636579442.0
oh2n21,Lardbear,CryptoCurrency,Biden Warns Russia's Putin to Act on Bitcoin Ransomware After $70 Million Attack,38,2021-07-09 14:21:09,1625858469.0
p2kk4w,angelwriter,Bitcoin,"Bitcoin Ransomware Hackers Hit Accenture, IT Consulting Firm Brushes It Off",2,2021-08-11 14:45:59,1628711159.0
oera7t,kryptovijoy,CryptoCurrency,“Analysts warn the latest massive Bitcoin Ransomware attack will turn more governments and corporations against crypto” - THIS,8,2021-07-06 04:10:03,1625562603.0
p2kudb,thebitcoinpartybot,the_bitcoin_party,"bitcoin ransomware hackers hit accenture, it consulting firm brushes it off",0,2021-08-11 15:00:32,1628712032.0
p2kqxm,TobiHovey,bitcoin_uncensored,"Bitcoin Ransomware Hackers Hit Accenture, IT Consulting Firm Brushes It Off",1,2021-08-11 14:55:51,1628711751.0
p2kqnz,TobiHovey,btc,"Bitcoin Ransomware Hackers Hit Accenture, IT Consulting Firm Brushes It Off",0,2021-08-11 14:55:28,1628711728.0
oq9ess,thebitcoinpartybot,the_bitcoin_party,bitcoin ransomware victim kaseya isn''t saying how it got the key to stop attack,0,2021-07-23 14:18:21,1627067901.0
ohkrg9,ZoolShop,CoinTuta,Biden Warns Russia's Putin to Act on Bitcoin Ransomware After $70 Million Attack,0,2021-07-10 10:27:56,1625930876.0
ojlzo9,BitcoinGazete,BitcoinGazete,"Bitcoin Ransomware Group REvil , Biden Ultimatum'dan Sonra Çevrimdışı Oldu",0,2021-07-13 13:42:16,1626201736.0
oh2o75,ASICmachine,CryptoCurrencyClassic,Biden Warns Russia's Putin to Act on Bitcoin Ransomware After $70 Million Attack (x-post from /r/Cryptocurrency),0,2021-07-09 14:22:47,1625858567.0
oer9cm,thenycgal,defisignals,Analysts warn the latest massive Bitcoin Ransomware attack will turn more governments and corporations against crypto,1,2021-07-06 04:07:56,1625562476.0
oh32g5,ASICmachine,CryptoCurrencyClassic,Biden Warns Russia's Putin to Act on Bitcoin Ransomware After $70 Million Attack (x-post from /r/Cryptocurrency),0,2021-07-09 14:42:54,1625859774.0
ojmlja,ASICmachine,CryptoCurrencyClassic,Bitcoin Ransomware Group REvil Goes Offline After Biden Ultimatum (x-post from /r/Cryptocurrency),0,2021-07-13 14:11:04,1626203464.0
o7ahmo,ZoolShop,CoinTuta,Clustering Bitcoin Ransomware with Python @Plutohash.com,0,2021-06-24 16:32:28,1624570348.0
o6jf60,ASICmachine,CryptoCurrencyClassic,Clustering Bitcoin Ransomware with Python @Plutohash.com (x-post from /r/Bitcoin),0,2021-06-23 13:57:00,1624474620.0
oercyr,ASICmachine,CryptoCurrencyClassic,“Analysts warn the latest massive Bitcoin Ransomware attack will turn more governments and corporations against crypto” - THIS (x-post from /r/Cryptocurrency),0,2021-07-06 04:16:47,1625563007.0
o6jtj8,ASICmachine,CryptoCurrencyClassic,Clustering Bitcoin Ransomware with Python @Plutohash.com (x-post from /r/Bitcoin),0,2021-06-23 14:17:04,1624475824.0
