ID,Author,Subreddit,Title,Number of comments,Time Posted,UTC
ncek0p,RightMillennial,Conservative,"DarkSide Ransomware Gang Quits After Servers, Bitcoin Stash Seized",16,2021-05-14 12:48:55,1621014535.0
oe9nhu,Fluid_Department_120,CryptoCurrency,What the REvil Ransomware Attack Means for Bitcoin,6,2021-07-05 10:25:55,1625498755.0
n8ga4r,DrJohnH1,Wallstreetsilver,Does the Pipeline Ransomware attack spell the end of Bitcoin and a rush into Silver?,12,2021-05-09 10:17:04,1620573424.0
n1s25w,tides977,technology,"""Give us 45 Bitcoins or your company dies"". BBC speaks to 2 organisations hit with crippling ransomware as a global task force is launched to try to end the ransomware surge.",28,2021-04-30 06:42:57,1619782977.0
nmz6l3,Im_not_JB,technology,The Ransomware Problem Is a Bitcoin Problem,35,2021-05-28 09:35:11,1622212511.0
nmh5n4,Donny_Krugerson,neoliberal,The Ransomware Problem Is a Bitcoin Problem,11,2021-05-27 15:44:25,1622148265.0
q27c98,SxQuadro,ethtrader,"JP Morgan CEO: Crypto is used for Tax Avoidance, Sex Trafficking and Ransomware, has no real Value: Why does his Company offer Crypto Trading to their Richest Customers then?",19,2021-10-05 17:34:12,1633473252.0
pff34i,leftok,atbitcoin,Why employers should care about Bitcoin in ransomware attacks,0,2021-08-31 16:17:08,1630444628.0
nsz778,koavf,CryptoCurrency,The Ransomware Problem Is a Bitcoin Problem,39,2021-06-05 11:13:55,1622909635.0
pfiqzj,ASICmachine,CryptoCurrencyClassic,"Better way to stop ransomware: ""disrupt Bitcoin"" (x-post from /r/Cryptocurrency)",0,2021-08-31 19:40:51,1630456851.0
nuty2h,bay_ridge,dogecoin,"If US able to recover some of the Bitcoin from the ransomware, how secure is crypto?",14,2021-06-07 21:17:55,1623118675.0
nynvo2,Extremely-Bad-Idea,Bitcoin,How to improve Bitcoin so it is unusable to ransomware attackers?,27,2021-06-12 22:37:53,1623555473.0
nwuybr,jonfla,ComputerSecurity,How Bitcoin Has Fueled Ransomware Attacks,6,2021-06-10 13:37:02,1623350222.0
nwrii5,username_takne,CryptoCurrency,JBS Paid $11 Million in Bitcoin To Ransomware Criminals,14,2021-06-10 11:14:01,1623341641.0
nnba4o,dgerard,Buttcoin,"News: Bitcoin mining leaves China, Chia sues blog about Chia, Warhol NFT, BitConnect charges, ban crypto to stop ransomware, FCA and crypto firms",5,2021-05-28 19:13:21,1622247201.0
oe6c9h,Sourcandybars,CryptoCurrencies,"Huge Ransomware Attack Hits Hundreds Of U.S. Companies, Hacker Group REvil Wants $70M In Bitcoin",5,2021-07-05 07:26:21,1625487981.0
nfh0r4,Few_Tumbleweed7151,conspiracy,"Shaun Bridges, the ex secret service agent and the government's foremost expert on digital currency, was quietly released from prison months ago. Shaun’s role could be to kill Bitcoin and conduct ransomware attacks on US firms. Why? Here’s why",10,2021-05-18 12:41:39,1621359699.0
o0p3n8,thecryptovantage,Bitcoin,Ransomware attacks could be a threat to bitcoin,18,2021-06-15 16:30:05,1623792605.0
paxpj7,PatrickFiorito,u_PatrickFiorito,"So.... Hackers are paying employees 1m in untraceable Bitcoin to install ransomware at their work place..... The problems, the corruption and the lack of integrity will only get worse.",0,2021-08-24 17:18:18,1629843498.0
nc6zyc,dgerard,Buttcoin,Toshiba refuses to accept that bitcoin is the future of payments! Tells ransomware gang to just fuck off,9,2021-05-14 07:04:37,1620993877.0
n0yew2,dgerard,Buttcoin,"US Government, industry push bitcoin regulation to fight ransomware scourge",16,2021-04-29 01:28:41,1619677721.0
pqmm8v,Tarps-celom,politics,US aims to hit revenue streams of ransomware groups with sanctions,13,2021-09-18 08:39:18,1631972358.0
qmr7v4,nothing_fits,AskReddit,"If an evil person ransomwared all of Google's user data (all youtube videos, google drive, gmail, etc), what do you think would be Google's upper limit they would pay to restore all of your stuff?",8,2021-11-04 13:32:13,1636050733.0
nrwwkq,dect60,Buttcoin,Fujifilm ransomware attack - this is good for Bitcoin!,6,2021-06-03 23:52:25,1622782345.0
q40coe,Fizzlebang_Wonderpop,CryptoCurrency,"FBI Works With Europol to Arrest Ransomware Gang, $1.3 Million in Cryptocurrencies Seized",15,2021-10-08 10:43:04,1633707784.0
nsdege,YoMomsHubby,CryptoCurrency,Deputy AG wants bitcoin exchanges' help to fight ransomware,9,2021-06-04 14:33:01,1622835181.0
pskszn,Okbuddygeorgist,politics,Biden sanctions cryptocurrency exchange over ransomware attacks,9,2021-09-21 10:15:09,1632237309.0
oiyfwc,TobiHovey,Bitcoin,Ransomware Attackers Made Off With $33M in Bitcoin This Year,5,2021-07-12 14:27:07,1626118027.0
ptkpkd,AmericanScream,CryptoReality,"There are the many things that cryptocurrency might someday be, and then there is what crypto really is. Neither is anything that a normal person would really need or care about unless you're the victim of a ransomware, want to buy drugs online, or needs to discretely send $250,000 to Roger Stone.",26,2021-09-22 20:34:25,1632360865.0
o216lg,cegras,Buttcoin,How to Cut Down on Ransomware Attacks Without Banning Bitcoin,4,2021-06-17 11:23:01,1623946981.0
ns1e2u,diarpiiiii,CryptoCurrency,[Podcast] Coindesk: Ransomware Is the Next Big Bitcoin FUD,8,2021-06-04 04:56:01,1622800561.0
oeb58p,CryptoAddict420,CryptoCurrency,"Ransomware Group REvil Strikes Again, Demands $70M in Bitcoin From 200 US Firms",6,2021-07-05 11:41:45,1625503305.0
nop1fj,Amun-Aion,CryptoCurrency,Future of the fungibility of Bitcoin in the face of ransomware payments?,14,2021-05-30 20:10:10,1622423410.0
ncsuhs,chuloreddit,CryptoCurrency,"DarkSide Ransomware Gang Quits After Servers, Bitcoin Stash Seized",13,2021-05-15 02:03:45,1621062225.0
nbw6gv,notanexpertguy,Bitcoin,Colonial ransomware payment in bitcoin traceability,12,2021-05-13 19:44:00,1620953040.0
p4pwi9,Thecoinscapture,u_Thecoinscapture,News: #Venezuelan #Kidnappers Demand #Bitcoin As #Ransomware,0,2021-08-15 03:42:34,1629016954.0
q9jgsr,shalyar,CryptoCurrency,"Over $5 Billion In BTC Paid In Top 10 Ransomware Variants, Says U.S. Treasury",16,2021-10-16 15:04:04,1634414644.0
p2wy6p,himig1449,cryptocurrencynews,IT giant Accenture targeted by Bitcoin (BTC) ransomware,0,2021-08-12 05:17:22,1628763442.0
nitfsu,SJWcucksoyboy,Bitcoin,How bitcoin created a ransomware plague,28,2021-05-22 17:12:23,1621721543.0
nwl85k,zsreport,technology,How Bitcoin Has Fueled Ransomware Attacks,4,2021-06-10 06:26:35,1623324395.0
nuorug,magenta_placenta,Bitcoin,US Recovers Millions in Bitcoin Paid to Colonial Pipeline Ransomware Hackers,8,2021-06-07 16:56:50,1623103010.0
nul4lj,eldiablo31415,Bitcoin,First on CNN: US recovers millions in cryptocurrency paid to Colonial Pipeline ransomware hackers,363,2021-06-07 14:24:57,1623093897.0
qbcdli,imEvts,techsupport,Got hit by .mars ransomware. Lost very important files.,12,2021-10-19 09:13:50,1634652830.0
r0ayot,svanapps,CryptoToFuture,Black|Web: Cryptocurrency exchange BTC-Alpha confirms ransomware attack,1,2021-11-23 05:11:46,1637665906.0
q2y9v2,NightKniqht,CryptoCurrency,Justice Department announces 'Cryptocurrency Enforcement Team' to tackle money laundering and ransomware attacks,16,2021-10-06 20:24:01,1633569841.0
oitpo2,ishankbahl,Bitcoin,Ransomware Attackers Made Off With $33M in Bitcoin This Year - Decrypt,3,2021-07-12 10:34:40,1626104080.0
nmmnf0,DoremusJessup,Bitcoin,The Ransomware Problem Is a Bitcoin Problem,16,2021-05-27 20:27:22,1622165242.0
o7bc56,Pilebsa,Freethought,"Swiss top level central bank BIS warns, ""Bitcoin is not money — it is a speculative asset that can be used by organised crime to launder money and launch ransomware attacks.""",2,2021-06-24 18:15:39,1624576539.0
oehi74,TobiHovey,Crypto_Currency_News,What the REvil Ransomware Attack Means for Bitcoin,2,2021-07-05 17:06:25,1625522785.0
od00ob,WannoHacker,business,"Hundreds of US companies hit by 'devastating' ransomware attack, cyber experts say",87,2021-07-03 10:19:02,1625325542.0
oiql7u,quellaman,InfoSecNews,Ransomware: This new ransom tracker reveals how much bitcoin gangs have been paid,0,2021-07-12 07:49:25,1626094165.0
nsdmva,MsKim,conspiracy,The Ransomware Problem Is a Bitcoin Problem,7,2021-06-04 14:42:51,1622835771.0
nvkbjn,meme_lord_victorious,dogecoin,All crypto is in doubt since the US government somehow tracked and hacked the Bitcoin wallet used in the pipeline ransomware attack. https://www.google.com/amp/s/www.nbcnews.com/news/amp/ncna1269889,9,2021-06-08 20:47:41,1623203261.0
ohtkth,NORDLAN,WorldNews_Serious,How bitcoin and Putin are enabling the ransomware crime spree | John Naughton,0,2021-07-10 18:41:58,1625960518.0
ncecxk,hyperinflationUSA,Bitcoin,"DarkSide Ransomware Gang Quits After Servers, Bitcoin Stash Seized",8,2021-05-14 12:40:16,1621014016.0
oit9ac,NewsElfForEnterprise,NewsfeedForWork,Ransomware: This new ransom tracker reveals how much bitcoin gangs have been paid,2,2021-07-12 10:12:48,1626102768.0
nl0il5,dgerard,Buttcoin,"WSJ: ""We can live in a world with cryptocurrency or a world without ransomware, but we can’t have both. It is time for the adults to tell the children: Party’s over.""",335,2021-05-25 16:28:13,1621978093.0
o0gd45,MochaWithSugar,CryptoCurrencies,"No, the federal seizure of Colonial Pipeline ransomware payments did not 'break' Bitcoin",2,2021-06-15 10:00:15,1623769215.0
os9k69,subscribe-by-reddit,SchneierOnSecurity,Disrupting Ransomware by Disrupting Bitcoin,0,2021-07-26 17:17:14,1627337834.0
otmwos,Hackburg,u_Hackburg,"EU Takes Aim At Ransomware With Plans To Make Bitcoin Traceable, Prohibit Anonymity.",0,2021-07-28 19:40:51,1627519251.0
oiyfhi,TobiHovey,Crypto_Currency_News,Ransomware Attackers Made Off With $33M in Bitcoin This Year,0,2021-07-12 14:26:33,1626117993.0
os1cht,svanapps,CryptoToFuture,Disrupting Ransomware by Disrupting Bitcoin,1,2021-07-26 10:41:51,1627314111.0
nw15ev,farva_litter_cola,Bitcoin,How Did the Feds Seize the Colonial Pipeline Ransomware Bitcoins?,7,2021-06-09 12:19:09,1623259149.0
orwwgn,thebitcoinpartybot,the_bitcoin_party,disrupting ransomware by disrupting bitcoin,0,2021-07-26 06:36:32,1627299392.0
oqek9z,fklivestolearn74,u_fklivestolearn74,This public tool keeps track of bitcoin payments to ransomware gangs,0,2021-07-23 18:49:29,1627084169.0
ox1i25,Mike_I,chicago,Ransomware attack costs Illinois attorney general's office more than $2.5M,27,2021-08-03 06:29:57,1627990197.0
nul66z,ivanoski-007,Buttcoin,CNN: US recovers millions in cryptocurrency paid to Colonial Pipeline ransomware hackers,204,2021-06-07 14:26:39,1623093999.0
qxhvjw,cdnkevin,CryptoCurrency,President Biden’s bank regulator pick expresses concern over bitcoin in confirmation hearing,19,2021-11-19 08:54:02,1637333642.0
oe6b1h,AutoModerator,EXDemocrats2021,REvil ransomware hackers demand $70M in Bitcoin for decryption key,1,2021-07-05 07:24:17,1625487857.0
oq2r35,svanapps,CryptoToFuture,"EU takes aim at ransomware with plans to make Bitcoin traceable, prohibit anonymity",1,2021-07-23 08:47:53,1627048073.0
ok0bnv,RiiguyHATESHFUNDS,CRYPTOComrade,Don't Blame Bitcoin for Ransomware | Daniel Kuhn,0,2021-07-14 03:52:30,1626252750.0
ncobna,wagnertamanaha,CryptoCurrency,Elliptic Follows the Bitcoin Ransoms Paid by Colonial Pipeline and Other DarkSide Ransomware Victims,5,2021-05-14 20:52:38,1621043558.0
oe301n,svanapps,CryptoToFuture,"r/Bitcoin - FBI warns of large 'scale' in US ransomware attack (H0LD, the FUD is coming…)",2,2021-07-05 03:39:59,1625474399.0
old6nx,thaibitcoin,u_thaibitcoin,"กระทรวงต่างประเทศสหรัฐฯ เปิดตัวโครงการ ""Rewards for Justice""ด้วยรางวัล $10M สำหรับข้อมูลที่นำไปสู่การจับกุมผู้โจมตี Ransomware - Bitcoin Addict",0,2021-07-16 04:09:29,1626426569.0
oqy76q,tikwanleap,Monero,REvil Revealed - Tracking a Ransomware Negotiation and Payment,34,2021-07-24 16:05:10,1627160710.0
nco11m,Bamboo_forest111,Bitcoin,Revisiting current events: Ransomware good for bitcoin?,9,2021-05-14 20:34:16,1621042456.0
okmk9d,ASICmachine,CryptoCurrencyClassic,"Ransomware Giant REvil Disappeared, After Attacking 1,500+ US Businesses, Demanding $70 Million In BTC, But Who Made Them Run? (x-post from /r/Bitcoin)",0,2021-07-15 00:52:17,1626328337.0
of2wzk,ZoolShop,CoinTuta,What the REvil Ransomware Attack Means for Bitcoin,0,2021-07-06 15:05:07,1625601907.0
k8m9dk,sour_creme,hacking,"Russian behind ""Locky"" ransomware sentenced to French prison for bitcoin laundering",22,2020-12-07 12:27:20,1607365640.0
ok4k7i,svanapps,CryptoToFuture,Bitcoin payments to major ransomware hacker groups hits $60 million,1,2021-07-14 08:40:24,1626270024.0
ohmwh6,UKNewsByABot,UKNewsByABot,How bitcoin and Putin are enabling the ransomware crime spree | John Naughton,0,2021-07-10 12:25:41,1625937941.0
ohl1ge,AutoNewsAdmin,GUARDIANauto,[Tech] - How bitcoin and Putin are enabling the ransomware crime spree | John Naughton,0,2021-07-10 10:43:44,1625931824.0
ohkaaw,thebitcoinpartybot,the_bitcoin_party,how bitcoin and putin are enabling the ransomware crime spree | john naughton,0,2021-07-10 10:01:55,1625929315.0
okf9so,svanapps,CryptoToFuture,The Use of Bitcoin and Cryptocurrencies in Ransomware Attacks: Why Employers Should Care,1,2021-07-14 17:26:06,1626301566.0
oj72tu,neil_simius,Simius,Ransomware: This new ransom tracker reveals how much bitcoin gangs have been paid | ZDNet,0,2021-07-12 22:18:15,1626146295.0
oiv14g,thebitcoinpartybot,the_bitcoin_party,ransomware: this new ransom tracker reveals how much bitcoin gangs have been paid,0,2021-07-12 11:41:14,1626108074.0
