ID,Author,Subreddit,Title,Number of comments,Time Posted,UTC
qr4kyw,krypto-news-deutsch,u_krypto-news-deutsch,Einzelhandelsriese Media Markt mit 50.000.000 $ Bitcoin-Ransomware-Nachfrage bei mutmaßlichem Angriff getroffen: Bericht,0,2021-11-10 15:24:02,1636579442.0
qr427c,procryptoclass,STYLYCRYPT,"Retail Giant Media Markt Hit With $50,000,000 Bitcoin Ransomware Demand in Alleged Attack: Report",0,2021-11-10 15:00:28,1636578028.0
qs4pt8,Official_CKM,u_Official_CKM,Finland Warming up for Bitcoin Ransomware Attack with Cyber Fire Drill,0,2021-11-11 23:53:59,1636696439.0
oh2n21,Lardbear,CryptoCurrency,Biden Warns Russia's Putin to Act on Bitcoin Ransomware After $70 Million Attack,38,2021-07-09 14:21:09,1625858469.0
p2kk4w,angelwriter,Bitcoin,"Bitcoin Ransomware Hackers Hit Accenture, IT Consulting Firm Brushes It Off",2,2021-08-11 14:45:59,1628711159.0
p2kudb,thebitcoinpartybot,the_bitcoin_party,"bitcoin ransomware hackers hit accenture, it consulting firm brushes it off",0,2021-08-11 15:00:32,1628712032.0
oera7t,kryptovijoy,CryptoCurrency,“Analysts warn the latest massive Bitcoin Ransomware attack will turn more governments and corporations against crypto” - THIS,8,2021-07-06 04:10:03,1625562603.0
p2kqnz,TobiHovey,btc,"Bitcoin Ransomware Hackers Hit Accenture, IT Consulting Firm Brushes It Off",0,2021-08-11 14:55:28,1628711728.0
p2kqxm,TobiHovey,bitcoin_uncensored,"Bitcoin Ransomware Hackers Hit Accenture, IT Consulting Firm Brushes It Off",1,2021-08-11 14:55:51,1628711751.0
oq9ess,thebitcoinpartybot,the_bitcoin_party,bitcoin ransomware victim kaseya isn''t saying how it got the key to stop attack,0,2021-07-23 14:18:21,1627067901.0
ohkrg9,ZoolShop,CoinTuta,Biden Warns Russia's Putin to Act on Bitcoin Ransomware After $70 Million Attack,0,2021-07-10 10:27:56,1625930876.0
ojlzo9,BitcoinGazete,BitcoinGazete,"Bitcoin Ransomware Group REvil , Biden Ultimatum'dan Sonra Çevrimdışı Oldu",0,2021-07-13 13:42:16,1626201736.0
oer9cm,thenycgal,defisignals,Analysts warn the latest massive Bitcoin Ransomware attack will turn more governments and corporations against crypto,1,2021-07-06 04:07:56,1625562476.0
oh2o75,ASICmachine,CryptoCurrencyClassic,Biden Warns Russia's Putin to Act on Bitcoin Ransomware After $70 Million Attack (x-post from /r/Cryptocurrency),0,2021-07-09 14:22:47,1625858567.0
oh32g5,ASICmachine,CryptoCurrencyClassic,Biden Warns Russia's Putin to Act on Bitcoin Ransomware After $70 Million Attack (x-post from /r/Cryptocurrency),0,2021-07-09 14:42:54,1625859774.0
o7ahmo,ZoolShop,CoinTuta,Clustering Bitcoin Ransomware with Python @Plutohash.com,0,2021-06-24 16:32:28,1624570348.0
o6jf60,ASICmachine,CryptoCurrencyClassic,Clustering Bitcoin Ransomware with Python @Plutohash.com (x-post from /r/Bitcoin),0,2021-06-23 13:57:00,1624474620.0
ojmlja,ASICmachine,CryptoCurrencyClassic,Bitcoin Ransomware Group REvil Goes Offline After Biden Ultimatum (x-post from /r/Cryptocurrency),0,2021-07-13 14:11:04,1626203464.0
oercyr,ASICmachine,CryptoCurrencyClassic,“Analysts warn the latest massive Bitcoin Ransomware attack will turn more governments and corporations against crypto” - THIS (x-post from /r/Cryptocurrency),0,2021-07-06 04:16:47,1625563007.0
o6jtj8,ASICmachine,CryptoCurrencyClassic,Clustering Bitcoin Ransomware with Python @Plutohash.com (x-post from /r/Bitcoin),0,2021-06-23 14:17:04,1624475824.0
o6jc1c,isaac1972,Bitcoin,Clustering Bitcoin Ransomware with Python @Plutohash.com,0,2021-06-23 13:52:16,1624474336.0
nwbt66,ZoolShop,CoinTuta,World’s Largest Meat Company Pays $11M in Bitcoin Ransomware Attack,0,2021-06-09 20:34:29,1623288869.0
nwfm75,lha1107,TheOnionNews,World’s Largest Meat Company Pays $11M in Bitcoin Ransomware Attack,0,2021-06-10 00:09:00,1623301740.0
nwg5sq,ASICmachine,CryptoCurrencyClassic,Worlds Largest Meat Company Pays $11M in Bitcoin Ransomware Attack (x-post from /r/Cryptocurrency),0,2021-06-10 00:42:59,1623303779.0
kukgzc,Ranzware,BitNewsLive,This Bitcoin Ransomware Rakes in $150 Million in BTC,0,2021-01-10 13:05:44,1610305544.0
nimau5,pepperonimilkjuice5,CryptoCurrency,5 Lessons from Bitcoin’s Very Bad Week,38,2021-05-22 11:27:41,1621700861.0
p3gcfu,Raaljebuzeth,CryptoCurrency,Crypto believers want to know: What’s the carbon footprint of the US military?,13,2021-08-12 23:30:58,1628829058.0
q901qv,kry_some_more,technology,US links $5.2 billion worth of Bitcoin transactions to ransomware,434,2021-10-15 18:25:59,1634340359.0
nc5e78,frieddurian,hackerdigest,"/r/technology top posts: May 14, 2021",0,2021-05-14 05:27:21,1620988041.0
r6kkk8,zippyteach,CryptoCurrency,"""Authorities seized a crypto wallet containing 39.89138522 bitcoins from Aleksandr Sikerin, who is affiliated with a ransomware outfit named REvil.""",19,2021-12-01 11:49:41,1638380981.0
qqv6dc,TobiHovey,CryptoCurrencies,Electronics Outlet MediaMarkt Hit by Ransomware Attack Demanding $50M in Bitcoin,90,2021-11-10 08:05:19,1636553119.0
qap9nd,POTATO_IN_MY_LOGIC,Buttcoin,Sinclair TV stations disrupted across the US after ransomware attack. This is good for Bitcoin! Mainstream adoption soon!,22,2021-10-18 10:43:03,1634571783.0
qqpeew,mWo12,Monero,"Alleged Ransomware Perpetrators Who Demanded Payment in Bitcoin &amp; Monero, Charged by US Department of Justice in Kaseya Scam",8,2021-11-10 02:02:04,1636531324.0
qpynwq,bonnerforrest,CryptoCurrency,US Treasury Adds Bitcoin Exchange to Sanctions List Over Ransomware Links,8,2021-11-09 01:41:41,1636443701.0
qaq2hj,MentalUsurpation,CryptoCurrency,$5.2 billion worth of Bitcoin (BTC) paid out in ransomware,15,2021-10-18 11:21:18,1634574078.0
qdlrzb,kry_some_more,technology,DarkSide ransomware operators move 6.8M worth of Bitcoin after REvil shutdown,7,2021-10-22 12:24:23,1634923463.0
r8gmuz,krypto-news-deutsch,u_krypto-news-deutsch,"FBI beschlagnahmt Bitcoin im Wert von mehr als 2,2 Millionen US-Dollar von Ransomware-Partner – News Das Federal Bureau of Investigation (FBI) hat Bitcoin im Wert von mehr als 2,2 Millionen US-Dollar im Zusammenhang mit Ransomware-Zahlungen beschlagnahmt. Die Kryptowährung gehört angebli...",0,2021-12-03 21:39:20,1638589160.0
r8go8m,krypto-news-deutsch,u_krypto-news-deutsch,FBI seizes more than $ 2.2 million worth of Bitcoin from ransomware partner - News - Crypto News,0,2021-12-03 21:41:19,1638589279.0
qb62vx,naji102,CryptoCurrency,FinCEN Links More Than $5 Billion in Bitcoin Transactions to Ransomware,14,2021-10-19 02:03:05,1634626985.0
r8ixxv,zachparker7,CryptoSource,FBI Seizes Bitcoin Worth More Than $2.2 Million From Ransomware Affiliate,0,2021-12-03 23:54:47,1638597287.0
r8j9ug,leftok,atbitcoin,The Week in Ransomware - December 3rd 2021 - Seizing Bitcoin,0,2021-12-04 00:14:55,1638598495.0
r6kmeu,ASICmachine,CryptoCurrencyClassic,"""Authorities seized a crypto wallet containing 39.89138522 bitcoins from Aleksandr Sikerin, who is affiliated with a ransomware outfit named REvil."" (x-post from /r/Cryptocurrency)",0,2021-12-01 11:51:52,1638381112.0
r6q3ao,ASICmachine,CryptoCurrencyClassic,"FBI seized $2.3M from affiliate of REvil, Gandcrab ransomware gangs (x-post from /r/Bitcoin)",0,2021-12-01 15:45:17,1638395117.0
r41ro5,1c4t,teenagersnew,"The WannaCry ransomware attack was a worldwide cyberattack in May 2017 by the WannaCry ransomware cryptoworm, which targeted computers running the Microsoft Windows operating system by encrypting data and demanding ransom payments in the Bitcoin cryptocurrency.",0,2021-11-28 04:51:25,1638096685.0
ncffpb,Kuandtity,news,"DarkSide ransomware group responsible for pipeline hack quits after servers, bitcoin stash seized",347,2021-05-14 13:27:17,1621016837.0
qqvdhj,TobiHovey,bitcoin_uncensored,Electronics Outlet MediaMarkt Hit by Ransomware Attack Demanding $50M in Bitcoin,1,2021-11-10 08:14:57,1636553697.0
qvgn9j,svanapps,CryptoToFuture,"Bitcoin price boom is helping sustain ransomware hackers, FBI says",1,2021-11-16 14:01:18,1637092878.0
qvrk17,IWdotcom,u_IWdotcom,US will reportedly impose crypto sanctions amid ransomware attacks via InnovationWarrior.Com #Bitcoin #Cryptocurrency #Cybersecurity #InfoSec #Security #Megatrends #EmergingTech #Tech,0,2021-11-16 23:03:15,1637125395.0
qvfvs5,DISANews,StonkFeed,": Bitcoin price boom is helping sustain ransomware hackers, FBI says",0,2021-11-16 13:28:36,1637090916.0
qvgism,ASICmachine,CryptoCurrencyClassic,Now FBI says high bitcoin price helping sustain ransomware hackers (x-post from /r/Cryptocurrency),0,2021-11-16 13:56:05,1637092565.0
qvg2h1,Top_Location,CitadelLLC,": Bitcoin price boom is helping sustain ransomware hackers, FBI says",0,2021-11-16 13:36:23,1637091383.0
qvibev,leftok,atbitcoin,"Bitcoin price boom is helping sustain ransomware hackers, FBI says",0,2021-11-16 15:15:17,1637097317.0
qqv67o,TobiHovey,Crypto_Currency_News,Electronics Outlet MediaMarkt Hit by Ransomware Attack Demanding $50M in Bitcoin,0,2021-11-10 08:05:08,1636553108.0
qqvg1r,ASICmachine,CryptoCurrencyClassic,Electronics Outlet MediaMarkt Hit by Ransomware Attack Demanding $50M in Bitcoin (x-post from /r/Cryptocurrency),0,2021-11-10 08:18:31,1636553911.0
qqv6hc,TobiHovey,CryptoNews,Electronics Outlet MediaMarkt Hit by Ransomware Attack Demanding $50M in Bitcoin,0,2021-11-10 08:05:29,1636553129.0
qqvd75,TobiHovey,CryptoNewsHub,Electronics Outlet MediaMarkt Hit by Ransomware Attack Demanding $50M in Bitcoin,0,2021-11-10 08:14:33,1636553673.0
qqv6jv,TobiHovey,Cryptonewsworld,Electronics Outlet MediaMarkt Hit by Ransomware Attack Demanding $50M in Bitcoin,0,2021-11-10 08:05:36,1636553136.0
qpl3ny,procryptoclass,STYLYCRYPT,US Treasury Adds Bitcoin Exchange to Sanctions List Over Ransomware Links,0,2021-11-08 13:27:39,1636399659.0
qqvddl,TobiHovey,btc,Electronics Outlet MediaMarkt Hit by Ransomware Attack Demanding $50M in Bitcoin,1,2021-11-10 08:14:49,1636553689.0
qqvd0k,TobiHovey,cryptonewswire,Electronics Outlet MediaMarkt Hit by Ransomware Attack Demanding $50M in Bitcoin,0,2021-11-10 08:14:19,1636553659.0
qqrugj,procryptoclass,STYLYCRYPT,Electronics Outlet MediaMarkt Hit by Ransomware Attack Demanding $50M in Bitcoin,0,2021-11-10 04:57:11,1636541831.0
qqv6na,TobiHovey,CryptoNewsandTalk,Electronics Outlet MediaMarkt Hit by Ransomware Attack Demanding $50M in Bitcoin,0,2021-11-10 08:05:42,1636553142.0
qor2c0,meneame_el_reddit,MeneamePortada,Yo he negociado con los crackers en un ataque ransomware: nos pedían 1 bitcoin o perdíamos toda nuestra información,0,2021-11-07 09:43:08,1636299788.0
pslk01,damnsonwhyyoutrippin,CryptoCurrency,U.S. Sanctions Russian Bitcoin Exchange Over $160M in Ransomware Transactions,9,2021-09-21 10:52:24,1632239544.0
qqwyea,ZoolShop,CoinTuta,Electronics Retailer MediaMarkt Hit by Ransomware Demand for $50M Bitcoin Payment: Report,0,2021-11-10 09:31:21,1636558281.0
qdooij,quellaman,InfoSecNews,DarkSide ransomware operators move 6.8M worth of Bitcoin after REvil shutdown,0,2021-10-22 14:45:18,1634931918.0
qpyvmi,ASICmachine,CryptoCurrencyClassic,US Treasury Adds Bitcoin Exchange to Sanctions List Over Ransomware Links (x-post from /r/Cryptocurrency),0,2021-11-09 01:59:18,1636444758.0
oe1ces,erdal_mutlu,CryptoCurrency,"Ransomware Group REvil Strikes Again, Demands $70M in Bitcoin from 200 US Firms",89,2021-07-05 01:28:25,1625466505.0
qouaxt,Arthuurtel120,MundoCripto,Yo he negociado con los crackers en un ataque ransomware: nos pedían 1 bitcoin o perdíamos toda nuestra información,1,2021-11-07 12:15:43,1636308943.0
p75hcj,nickname432,Bitcoin,"Has anyone watched the latest piece of 'Last Week Tonight' on ransomware? Bitcoin is presented as an enabler, which is unfair.",31,2021-08-18 21:00:49,1629338449.0
nuliw9,Banshee--,CryptoCurrency,"How did they ""seize"" the funds from the Bitcoin wallet in the Colonial Pipeline Ransomware attack?",159,2021-06-07 14:40:52,1623094852.0
qdkfw0,PooperOfMoons,NoStupidQuestions,"When ransomware attackers get paid in Bitcoin, how do they turn it into real money without being traced?",2,2021-10-22 11:20:43,1634919643.0
qiw0mg,IWdotcom,u_IWdotcom,US will reportedly impose crypto sanctions amid ransomware attacks via InnovationWarrior.Com #Bitcoin #Cryptocurrency #Cybersecurity #InfoSec #Security #Megatrends #EmergingTech #Tech,0,2021-10-30 02:00:04,1635577204.0
r8gwoh,alexo12,CryptoCurrency,The Federal Bureau of Investigation (FBI) has seized BTC worth more than $2.2 million tied to ransomware payments.,14,2021-12-03 21:54:45,1638590085.0
qhy4or,tmiklas,bag_o_news,DarkSide ransomware rushes to cash out $7 million in Bitcoin,0,2021-10-28 17:22:34,1635459754.0
qfcwiu,Notelbaxy,CyberNews,DarkSide ransomware rushes to cash out $7 million in Bitcoin,0,2021-10-25 04:28:18,1635154098.0
oezqxy,jthawks,CryptoCurrency,"Governments shouldn't be upset Bitcoin is being used for Ransomware attacks, they should be taking notes and be thankful that someone is showing them how vulnerable our crucial systems have become.",31,2021-07-06 12:31:15,1625592675.0
qzo1y5,Tryingsoveryhard,unpopularopinion,Crypto currencies facilitate ransomware attacks.,46,2021-11-22 09:33:12,1637595192.0
ncc0fx,z3nch4n,cybersecurity,"DarkSide Ransomware Gang Quits After Servers, Bitcoin Stash Seized",64,2021-05-14 10:59:15,1621007955.0
qagtot,farklinkbot,fark,"TV stations owned by Sinclair hit by a ransomware attack Sunday, knocking local programming off the air. Sinclair bosses to blame antifa, BLM, and liberals as soon as they learn what bitcoin is",0,2021-10-18 01:15:05,1634537705.0
qogfol,Apxm,news,Feds offer $10 million reward in hunt for DarkSide ransomware group,11,2021-11-06 22:45:42,1636256742.0
qdnwlu,svanapps,CryptoToFuture,DarkSide Ransomware Gang Moves Bitcoin Reserves After REvil Got Hit by Law Enforcement Action,1,2021-10-22 14:07:24,1634929644.0
qdk2q3,RedPacketSecurity,RedPacketSecurity,DarkSide ransomware operators move 6.8M worth of Bitcoin after REvil shutdown,0,2021-10-22 11:03:16,1634918596.0
qem5wj,rtbot2,realtech,DarkSide ransomware operators move 6.8M worth of Bitcoin after REvil shutdown,1,2021-10-24 01:00:05,1635055205.0
qdn9sm,falconupkid,SecOpsDaily,DarkSide ransomware rushes to cash out $7 million in Bitcoin- at the time of posting the wallets contain around $3 M USD in bitcoin,0,2021-10-22 13:36:20,1634927780.0
qdncbb,svanapps,CryptoToFuture,DarkSide ransomware rushes to cash out $7 million in Bitcoin,1,2021-10-22 13:39:45,1634927985.0
qdhyda,TrendsWide,TrendsNewsWorld,$6.8M in Bitcoin held by DarkSide ransomware group on the move,0,2021-10-22 09:20:11,1634912411.0
oe6bnu,Jezzadoe,AltStreetBets,"Huge Ransomware Attack Hits Hundreds Of U.S. Companies, Hacker Group REvil Wants $70M In Bitcoin",31,2021-07-05 07:25:19,1625487919.0
qch3s8,leftok,atbitcoin,$5.2 billion worth of Bitcoin transactions possibly tied to ransomware,0,2021-10-20 21:14:54,1634782494.0
qdmmm8,businessyndicate,businesstalkdaily,DarkSide ransomware operators move 6.8M worth of Bitcoin after REvil shutdown,0,2021-10-22 13:04:58,1634925898.0
nniqe7,dgerard,Buttcoin,Nicholas Weaver: The Ransomware Problem Is a Bitcoin Problem,82,2021-05-29 03:13:07,1622275987.0
q90o10,autotldr,autotldr,US links $5.2 billion worth of Bitcoin transactions to ransomware,0,2021-10-15 19:02:05,1634342525.0
qdimvs,svanapps,CryptoToFuture,DarkSide ransomware operators move 6.8M worth of Bitcoin after REvil shutdown,1,2021-10-22 09:54:15,1634914455.0
nf8jup,shubhbadonia,cybersecurity,DarkSide Ransomware has Netted Over $90 million in Bitcoin,53,2021-05-18 06:44:37,1621338277.0
qb6az9,ASICmachine,CryptoCurrencyClassic,FinCEN Links More Than $5 Billion in Bitcoin Transactions to Ransomware (x-post from /r/Cryptocurrency),0,2021-10-19 02:20:59,1634628059.0
qackwi,ForeverSeahawks,technology,$590 mil in ransomware payments reported to U.S. in 2021 as attacks surge,34,2021-10-17 20:40:48,1634521248.0
qajztf,svanapps,CryptoToFuture,Bitcoin Most Demanded in Ransomware Payments According to FinCEN Report,1,2021-10-18 05:33:11,1634553191.0
qavsqr,svanapps,CryptoToFuture,"$5.2 billion worth of Bitcoin transactions linked to ransomware, coin nears all-time $64,800 high",1,2021-10-18 15:54:57,1634590497.0
qapxlc,theterk,tomshardware,"FinCEN: Ransomware on the Rise, Bitcoin Is the Most-Used Payment Method",0,2021-10-18 11:14:54,1634573694.0
qavfg5,krypto-news-deutsch,u_krypto-news-deutsch,Bitcoin im Wert von 5.200.000.000 US-Dollar im Zusammenhang mit Ransomware-Zahlungen im ersten Halbjahr 2021: FinCEN,0,2021-10-18 15:33:47,1634589227.0
qaqd4p,ASICmachine,CryptoCurrencyClassic,$5.2 billion worth of Bitcoin (BTC) paid out in ransomware (x-post from /r/Cryptocurrency),0,2021-10-18 11:35:39,1634574939.0
qba9dv,rkp1234br,MundoCripto,"Estados Unidos identifica transacciones de Bitcoin valoradas en 5,2 mil millones de dólares y vinculadas con ransomware",1,2021-10-19 07:15:26,1634645726.0
qavfl8,krypto-news-deutsch,krypto_deutsch,Bitcoin im Wert von 5.200.000.000 US-Dollar im Zusammenhang mit Ransomware-Zahlungen im ersten Halbjahr 2021: FinCEN,0,2021-10-18 15:33:59,1634589239.0
q9tl0w,TheCoinrise,Thecoinrise,$5.2 billion in Bitcoin ($BTC) connected to ransomware payments,0,2021-10-17 01:54:07,1634453647.0
q8u04l,svanapps,CryptoToFuture,US links $5.2 billion worth of Bitcoin transactions to ransomware,1,2021-10-15 13:07:20,1634321240.0
q90pro,businessyndicate,businesstalkdaily,US links $5.2 billion worth of Bitcoin transactions to ransomware,0,2021-10-15 19:04:58,1634342698.0
q8tkbt,falconupkid,SecOpsDaily,US links $5.2 billion worth of Bitcoin transactions to ransomware,0,2021-10-15 12:45:59,1634319959.0
r6psxq,DrinkMoreCodeMore,CryptoCurrency,"FBI seized $2.3M from affiliate of REvil, Gandcrab ransomware gangs",7,2021-12-01 15:32:38,1638394358.0
pslz7c,TobiHovey,btc,U.S. Sanctions Russian Bitcoin Exchange Over $160M in Ransomware Transactions,2,2021-09-21 11:12:39,1632240759.0
pso149,AmericanScream,CryptoReality,U.S. Sanctions Russian Bitcoin Exchange Over $160M in Ransomware Transactions - Suex is the first cryptocurrency exchange to be added to the U.S. Treasury’s list of sanctioned entities.,1,2021-09-21 12:51:25,1632246685.0
q7gjjh,ASICmachine,CryptoCurrencyClassic,White House kicks off 2-day meeting to rally world leaders in push against ransomware (x-post from /r/Bitcoin),0,2021-10-13 12:47:26,1634147246.0
pslze6,TobiHovey,bitcoin_uncensored,U.S. Sanctions Russian Bitcoin Exchange Over $160M in Ransomware Transactions,1,2021-09-21 11:12:56,1632240776.0
nvbdph,SudoTheNym,HowToHack,Pipeline Ransomware Bitcoin recovered by the FBI?,32,2021-06-08 13:52:33,1623178353.0
nupg0z,magenta_placenta,conspiracy,US Recovers Millions in Bitcoin Paid to Colonial Pipeline Ransomware Hackers,43,2021-06-07 17:26:42,1623104802.0
q5ytfj,NewsElfForEnterprise,News_Finance,"Cryptocurrency Price Check: Bitcoin Rises, White House Voices Ransomware Concerns",0,2021-10-11 10:50:32,1633967432.0
q5zd5t,leftok,atbitcoin,"Cryptocurrency Price Check: Bitcoin Rises, White House Voices Ransomware Concerns",0,2021-10-11 11:14:37,1633968877.0
q50xvw,ASICmachine,CryptoCurrencyClassic,Biden administration set to ban crypto for ransomware payments (x-post from /r/Bitcoin),0,2021-10-09 23:18:13,1633839493.0
oe8c6w,madden1349,Buttcoin,What if I support ransomware but oppose Bitcoin?,31,2021-07-05 09:19:51,1625494791.0
oe6ax2,Jezzadoe,CryptoCurrency,"Huge Ransomware Attack Hits Hundreds Of U.S. Companies, Hacker Group REvil Wants $70M In Bitcoin",20,2021-07-05 07:24:04,1625487844.0
pzaepv,jamesonkh,NFTExchange,Retro Crypto ~ Intro to Ransomware ~ Bitcoin Hacker Edition ~ Vintage & Antique Cryptocurrency Ephemera,0,2021-10-01 10:30:40,1633102240.0
nslisg,stuntpope,Bitcoin,"Blame crappy software and bad security for ransomware, not Bitcoin",30,2021-06-04 21:23:26,1622859806.0
q253jd,BakedPotato840,CryptoCurrency,Elizabeth Warren's new bill would require ransomware victims to disclose the type of crypto they used to pay hackers - Might as well call the Monero Bill,40,2021-10-05 15:40:41,1633466441.0
ppfgat,Salt-Shop,SatoshiStreetBets,Bitcoin ledger as a secret weapon in war against ransomware,2,2021-09-16 10:25:02,1631805902.0
r6ptez,DrinkMoreCodeMore,Bitcoin,"FBI seized $2.3M from affiliate of REvil, Gandcrab ransomware gangs",2,2021-12-01 15:33:15,1638394395.0
oizbbb,NightKniqht,CryptoCurrency,Ransomware Attackers Made Off With $33M in Bitcoin This Year,15,2021-07-12 15:10:10,1626120610.0
nujuux,remweaver27,news,First on CNN: US recovers millions in cryptocurrency paid to Colonial Pipeline ransomware hackers,823,2021-06-07 13:35:47,1623090947.0
qw5dxa,WannoHacker,technology,UK fighting hacking epidemic as Russian ransomware attacks increase,2,2021-11-17 12:16:53,1637173013.0
nvhtjc,Blasto_Music,conspiracy,FBI Got Bitcoin Back From Pipeline Ransomware Group,24,2021-06-08 18:34:29,1623195269.0
r6vu9k,roe_boat,AskReddit,How do criminals get ransomware payments out into the real world if it's possible to view where the ransom money goes on the Blockchain?,6,2021-12-01 20:03:36,1638410616.0
ojmfrq,CryptoAddict420,CryptoCurrency,Don’t Blame Bitcoin for Ransomware,10,2021-07-13 14:03:30,1626203010.0
psltyq,ASICmachine,CryptoCurrencyClassic,U.S. Sanctions Russian Bitcoin Exchange Over $160M in Ransomware Transactions (x-post from /r/Cryptocurrency),0,2021-09-21 11:05:44,1632240344.0
pskl4r,ASICmachine,CryptoCurrencyClassic,U.S. Treasury sanctions cryptocurrency exchange for alleged role in ransomware attacks (x-post from /r/Bitcoin),0,2021-09-21 10:04:21,1632236661.0
qap6q9,Fizzlebang_Wonderpop,CryptoCurrency,Ransomware is now a billion-dollar market,33,2021-10-18 10:38:58,1634571538.0
psmiaa,cryptoallbot,cryptoall,U.S. Sanctions Russian Bitcoin Exchange Over $160M in Ransomware Transactions,0,2021-09-21 11:38:11,1632242291.0
pslzwi,TobiHovey,CryptoNews,U.S. Sanctions Russian Bitcoin Exchange Over $160M in Ransomware Transactions,0,2021-09-21 11:13:37,1632240817.0
nqr9e1,dgerard,Buttcoin,Ban Bitcoin and Other Cryptocurrencies to Stop Hackers’ Ransomware Attacks - more salty nocoiner slander of Bitcoin's organic adoption in the enterprise,18,2021-06-02 12:29:35,1622654975.0
pslzlv,TobiHovey,Crypto_Currency_News,U.S. Sanctions Russian Bitcoin Exchange Over $160M in Ransomware Transactions,0,2021-09-21 11:13:13,1632240793.0
osrc12,Fast_Carpenter,Buttcoin,So demand of bitcoin increased partly by increasing in ransomware ?,6,2021-07-27 12:31:16,1627407076.0
ncd1rb,mepper,technology,"DarkSide Ransomware Gang Quits After Servers, Bitcoin Stash Seized",21,2021-05-14 11:43:48,1621010628.0
ppvfgx,GaryPalmerJr,MintingCoins,Bitcoin ledger as a secret weapon in war against ransomware – Cointelegraph Magazine,0,2021-09-17 02:18:16,1631863096.0
nwi3zo,Monster_Chief17,CryptoCurrency,World's Largest Meat Producer JBS Pays $11M in Bitcoin to Ransomware Hackers,20,2021-06-10 02:57:40,1623311860.0
nvf0ji,ControlPotential,CryptoCurrency,"“Banning Bitcoin because of ransomware is foollish” - Michael Daniel, Former Obama Cybersecurity Specialist.",21,2021-06-08 16:27:48,1623187668.0
nv7ihs,SweetBasil_,CryptoCurrency,FBI Affidavit explaining how they ended up recovering ransomware bitcoins was released.,17,2021-06-08 11:01:16,1623168076.0
oexjs4,callmebaiken,conspiracy,Ransomware attacks meant to regulate Bitcoin?,6,2021-07-06 10:44:28,1625586268.0
qhgjav,cola_dose,de,Mutmaßlicher Ransomware-Millionär identifiziert,12,2021-10-28 01:15:41,1635401741.0
q24v7l,Primary_Ground_3858,ethtrader,"JP Morgan CEO: Crypto is used for Tax Avoidance, Sex Trafficking and Ransomware, has no real Value: Why does his Company offer Crypto Trading to their Richest Customers then?",25,2021-10-05 15:29:19,1633465759.0
ofcyla,buddyfake,CryptoCurrency,What the REvil Ransomware Attack Means for Bitcoin,10,2021-07-07 00:58:36,1625637516.0
ppfk68,ASICmachine,CryptoCurrencyClassic,Bitcoin ledger as a secret weapon in war against ransomware (x-post from /r/SatoshiStreetBets),0,2021-09-16 10:30:29,1631806229.0
ppffqg,thebitcoinpartybot,the_bitcoin_party,bitcoin ledger as a secret weapon in war against ransomware,0,2021-09-16 10:24:08,1631805848.0
psmxp1,shahin-13,news,U.S. Treasury sanctions cryptocurrency exchange for alleged role in ransomware attacks,26,2021-09-21 11:59:02,1632243542.0
ojkc2t,ComprehensiveLab7591,CryptoCurrency,Don't Blame Bitcoin for Ransomware | Daniel Kuhn,8,2021-07-13 12:23:47,1626197027.0
pq1sl9,tcrcabs,maharlikacoin,Bitcoin ledger as a secret weapon in war against ransomware,0,2021-09-17 09:59:35,1631890775.0
numtlh,titan127,CryptoCurrency,US official says 'majority' of bitcoin paid by Colonial Pipeline after ransomware attack has been recovered,24,2021-06-07 15:34:02,1623098042.0
nv3egz,jonfla,ComputerSecurity,How the FBI got Colonial Pipeline's ransomware bitcoin back from the hackers,7,2021-06-08 07:56:04,1623156964.0
numz2z,Ralphie_go_brrrr,Bitcoin,Colonial pipeline ransomware: they claim the Bitcoin has been recovered. Is this even possible?,19,2021-06-07 15:40:24,1623098424.0
ok1ktq,LordHughRAdumbass,xrmed,"(((🤖))) Transhuman World Problems: Please Help! My Neuralink brain implant just got hacked by ransomware and I'm frozen in place until I pay up 1,000 Bitcoin. I have to sort this out soon because the license on my transgenic amygdalia will expire if I don't pay the monthly sub by tomorrow.",5,2021-07-14 05:30:55,1626258655.0
oiyfoo,TobiHovey,CryptoCurrencies,Ransomware Attackers Made Off With $33M in Bitcoin This Year,4,2021-07-12 14:26:50,1626118010.0
oe5tx4,Crush632,dogecoin,"Ransomware Group REvil Strikes Again, Demands $70M in Bitcoin from 200 US Firms",6,2021-07-05 06:55:12,1625486112.0
oehidh,TobiHovey,Bitcoin,What the REvil Ransomware Attack Means for Bitcoin,7,2021-07-05 17:06:40,1625522800.0
of2hjk,Octopus-Pawn,CryptoCurrency,Will Bitcoin or Russia Be Blamed for the Latest Ransomware Attacks?,13,2021-07-06 14:44:19,1625600659.0
nuorbh,magenta_placenta,CryptoCurrency,US Recovers Millions in Bitcoin Paid to Colonial Pipeline Ransomware Hackers,19,2021-06-07 16:56:11,1623102971.0
os6462,Im_not_JB,technology,Disrupting Ransomware by Disrupting Bitcoin,7,2021-07-26 14:30:13,1627327813.0
